[
  {
    "entry_id": "e5e5e5e5-5555-4eee-bbbb-000000000001",
    "occurred_at": "2026-10-01T08:00:00Z",
    "line": "paid_call",
    "entry_type": "actual",
    "provider": "gemini",
    "model_id": "gemini-2.5-pro",
    "audit_id": "e5e5e5e5-5555-4aaa-bbbb-000000000001",
    "workflow": "registered_audit",
    "tokens": { "input": 50000, "output": 10000 },
    "amount": { "amount": "72.00", "currency": "USD" },
    "source": "post_call_actual",
    "cap_check": {
      "decision": "allowed",
      "month_to_date": { "amount": "72.00", "currency": "USD" },
      "checked_at": "2026-10-01T08:00:00Z"
    },
    "reconciled": false
  },
  {
    "entry_id": "e5e5e5e5-5555-4eee-bbbb-000000000002",
    "occurred_at": "2026-10-01T09:00:00Z",
    "line": "paid_call",
    "entry_type": "actual",
    "provider": "openai",
    "model_id": "gpt-4o",
    "audit_id": "e5e5e5e5-5555-4aaa-bbbb-000000000002",
    "workflow": "registered_audit",
    "tokens": { "input": 30000, "output": 8000 },
    "amount": { "amount": "45.00", "currency": "USD" },
    "source": "post_call_actual",
    "cap_check": {
      "decision": "allowed",
      "month_to_date": { "amount": "117.00", "currency": "USD" },
      "checked_at": "2026-10-01T09:00:00Z"
    },
    "reconciled": false
  },
  {
    "entry_id": "e5e5e5e5-5555-4eee-bbbb-000000000003",
    "occurred_at": "2026-10-01T09:30:00Z",
    "line": "paid_call",
    "entry_type": "actual",
    "provider": "gemini",
    "model_id": "gemini-2.5-pro",
    "audit_id": "e5e5e5e5-5555-4aaa-bbbb-000000000003",
    "workflow": "registered_audit",
    "tokens": { "input": 20000, "output": 5000 },
    "amount": { "amount": "25.00", "currency": "USD" },
    "source": "post_call_actual",
    "cap_check": {
      "decision": "allowed",
      "month_to_date": { "amount": "142.00", "currency": "USD" },
      "checked_at": "2026-10-01T09:30:00Z"
    },
    "reconciled": false
  }
]
